{
  "book_id": "OT-000",
  "official_name": "",
  "pt_br_name": "",
  "traditional_names": [],
  "geez_name": null,
  "transliteration": null,
  "identity": null,
  "identity_status": "UNVERIFIED",
  "canonical_layer": "UNCERTAIN",
  "canonical_order": null,
  "chronological_order": null,
  "composition_date": null,
  "composition_date_status": "UNKNOWN",
  "historical_period": null,
  "traditional_authorship": null,
  "academic_authorship": null,
  "original_language": [],
  "textual_tradition": [],
  "manuscripts": [],
  "editions": [],
  "translation_status": "NOT_STARTED",
  "text_status": "NOT_ACQUIRED",
  "license_status": "UNKNOWN",
  "sources": [],
  "notes": []
}
